check_point,submitted_source,answer_source,repo_decision
모멘텀 계산,6/12개월 함수가 `pct_change`의 fill limit만 바꾸어 월간 수익률에 가까운 값을 만들었다.,"최근 12개월 월간 수익률을 누적 곱하고, 6개월 모멘텀은 그중 최근 6개월만 누적했다.","`ret_m01`~`ret_m12`에서 `mom12`, `mom6`을 누적수익률로 다시 계산한다."
밸류 부호,"E/P, B/P를 높을수록 좋은 값으로 쓰려 했지만 rank z-score 방향 관리가 불안정했다.","PER, PBR은 낮을수록 좋으므로 `-PER`, `-PBR`로 부호를 명시했다.","양수 PER/PBR만 사용하고 `neg_per`, `neg_pbr`을 표준화한다."
정규화 순서,특성 rank z-score 후 MinMaxScaler를 적용해 점수 해석이 0~1 스케일에 묶였다.,"특성 z-score, 카테고리 z-score, 최종 z-score를 순서대로 적용했다.","모든 횡단면 표준화는 평균 0, 표준편차 1의 z-score로 통일한다."
후보 선택,상위 30개를 고른 뒤 수익률 결측 종목을 제거하고 추가 후보를 일부 보충했다.,결측이 없는 공통 유니버스에서 최종 점수 상위 30개를 선택했다.,수익률 이력이 있는 종목만 남긴 뒤 상위 후보를 선택한다.
최소분산 포트폴리오,"cvxpy와 PSD 보정으로 `1%<=w<=5%`, `sum(w)=1` 제약을 풀었다.",scipy SLSQP로 같은 하한/상한/합계 제약의 최소변동성 문제를 풀었다.,"scipy SLSQP를 기본으로 쓰고, 공분산 행렬은 대각 shrinkage와 고유값 보정으로 안정화한다."
